<?xml version="1.0" encoding="UTF-8"?>

<extension xmlns="http://ipt.gbif.org/extension/"
    xmlns:xsi="http://www.w3.org/2001/XMLSchema-instance"
    xsi:schemaLocation="../extension.xsd" 
    title="Identification History" name="Identification" namespace="http://rs.tdwg.org/dwc/terms/">
    <property name="NomenclaturalCode" namespace="http://rs.tdwg.org/dwc/terms/" qualName="http://rs.tdwg.org/dwc/terms/NomenclaturalCode"/>
    <property name="ScientificName" namespace="http://rs.tdwg.org/dwc/terms/" qualName="http://rs.tdwg.org/dwc/terms/ScientificName" required="true"/>
    <property name="TaxonAccordingTo" namespace="http://rs.tdwg.org/dwc/terms/" qualName="http://rs.tdwg.org/dwc/terms/TaxonAccordingTo"/>    
    <property name="IdentifiedBy" namespace="http://rs.tdwg.org/dwc/terms/" qualName="http://rs.tdwg.org/dwc/terms/IdentifiedBy" />
    <property name="DateIdentified" namespace="http://rs.tdwg.org/dwc/terms/" qualName="http://rs.tdwg.org/dwc/terms/DateIdentified" />
    <property name="IdentificationReferences" namespace="http://rs.tdwg.org/dwc/terms/" qualName="http://rs.tdwg.org/dwc/terms/IdentificationReferences" />
    <property name="IdentificationRemarks" namespace="http://rs.tdwg.org/dwc/terms/" qualName="http://rs.tdwg.org/dwc/terms/IdentificationRemarks" />
    <property name="IdentificationQualifier" namespace="http://rs.tdwg.org/dwc/terms/" qualName="http://rs.tdwg.org/dwc/terms/IdentificationQualifier" />
    <property name="TypeStatus" namespace="http://rs.tdwg.org/dwc/terms/" qualName="http://rs.tdwg.org/dwc/terms/TypeStatus" />
</extension>